{
  "verifier": {
    "id": "medagent.verifiers.dicom_preflight_quality_v1",
    "version": "0.1.0"
  },
  "target": {
    "evidence_pack": "examples/evidence_packs/dicom_series_preflight_trusted_pass/skill_run",
    "skill_id": "medagent.dicom_series_preflight",
    "source_overall_status": "passed",
    "skill_preflight_verdict": "pass"
  },
  "preflight_gate": {
    "findings": [],
    "n_fail": 0,
    "n_warn": 0,
    "verdict": "pass",
    "acceptable": true
  },
  "checks": [
    {
      "name": "skill_pack_readable",
      "status": "pass",
      "reason": "output.json present and skill id matches"
    },
    {
      "name": "source_skill_passed",
      "status": "pass",
      "reason": "source pack overall='passed'"
    },
    {
      "name": "no_fail_findings",
      "status": "pass",
      "reason": "fail findings: []"
    },
    {
      "name": "orientation_ok",
      "status": "pass",
      "reason": "axcodes=['L', 'P', 'S']"
    },
    {
      "name": "single_series",
      "status": "pass",
      "reason": "n_series=1"
    },
    {
      "name": "no_corrupt_instances",
      "status": "pass",
      "reason": "n_corrupt=0"
    }
  ],
  "overall": "pass"
}